<?xml version="1.0" encoding="windows-1252"?>
<!--
To change this license header, choose License Headers in Project Properties.
To change this template file, choose Tools | Templates
and open the template in the editor.
-->


<ns1:plantilla
    xmlns:xsi='http://www.w3.org/2001/XMLSchema-instance'
    xmlns:ns1='http://xml.netbeans.org/schema/cartel'
    xsi:schemaLocation='http://xml.netbeans.org/schema/cartel cartel.xsd'>
    <ns1:cabecera>
        <ns1:imagen></ns1:imagen>
        <ns1:fondo></ns1:fondo>
    </ns1:cabecera>
    <ns1:principal>
        <ns1:imagen></ns1:imagen>
        <ns1:fondo></ns1:fondo>
    </ns1:principal>
    <ns1:pie>
        <ns1:sponsor></ns1:sponsor>
        <ns1:sponsor></ns1:sponsor>
        <ns1:sponsor></ns1:sponsor>
        <ns1:sponsor></ns1:sponsor>
        <ns1:fondo></ns1:fondo>
    </ns1:pie>

</ns1:plantilla>
